,objective_description,objective_formulation,constraint_description,constraint_formulation,labels,description,problem_name
0,"""The goal is to maximize the total profit from investing in the real-estate market""",$\max \left( \text{ProfitPerDollarCondos} \cdot \text{investmentCondos} + \text{ProfitPerDollarDetachedHouses} \cdot \text{investmentDetachedHouses} \right)$,The total investment in condos and detached houses should not exceed the TotalBudget,$investmentCondos + investmentDetachedHouses \leq TotalBudget$,"{'types': ['Resource Allocation and Management', 'Portfolio Optimization'], 'domains': ['Finance and Banking']}","Mrs. Watson wants to invest in the real-estate market and has a total budget of at most TotalBudget. She has two choices which include condos and detached houses. Each dollar invested in condos yields a ProfitPerDollarCondos profit and each dollar invested in detached houses yields a ProfitPerDollarHouses profit. A minimum of MinPercentageCondos of the total investment must be in condos, and at least MinInvestmentDetached must be invested in detached houses.",1
1,"""The goal is to maximize the total profit from investing in the real-estate market""",$\max \left( \text{ProfitPerDollarCondos} \cdot \text{investmentCondos} + \text{ProfitPerDollarDetachedHouses} \cdot \text{investmentDetachedHouses} \right)$,The investment in condos must be at least MinPercentageCondos percent of the total investment,$investmentCondos \\geq MinPercentageCondos \\times (investmentCondos + investmentDetachedHouses)$,"{'types': ['Resource Allocation and Management', 'Portfolio Optimization'], 'domains': ['Finance and Banking']}","Mrs. Watson wants to invest in the real-estate market and has a total budget of at most TotalBudget. She has two choices which include condos and detached houses. Each dollar invested in condos yields a ProfitPerDollarCondos profit and each dollar invested in detached houses yields a ProfitPerDollarHouses profit. A minimum of MinPercentageCondos of the total investment must be in condos, and at least MinInvestmentDetached must be invested in detached houses.",1
2,"""The goal is to maximize the total profit from investing in the real-estate market""",$\max \left( \text{ProfitPerDollarCondos} \cdot \text{investmentCondos} + \text{ProfitPerDollarDetachedHouses} \cdot \text{investmentDetachedHouses} \right)$,The investment in detached houses must be at least MinInvestmentDetachedHouses,$investmentDetachedHouses \geq MinInvestmentDetachedHouses$,"{'types': ['Resource Allocation and Management', 'Portfolio Optimization'], 'domains': ['Finance and Banking']}","Mrs. Watson wants to invest in the real-estate market and has a total budget of at most TotalBudget. She has two choices which include condos and detached houses. Each dollar invested in condos yields a ProfitPerDollarCondos profit and each dollar invested in detached houses yields a ProfitPerDollarHouses profit. A minimum of MinPercentageCondos of the total investment must be in condos, and at least MinInvestmentDetached must be invested in detached houses.",1
3,"""The goal is to maximize the total profit from producing regular and special sandwiches""",$\max (\text{ProfitRegular} \times x + \text{ProfitSpecial} \times y)$,The total number of eggs used by regular and special sandwiches should not exceed the total number of eggs available,$EggsRegular \cdot x + EggsSpecial \cdot y \leq TotalEggs$,"{'types': ['Resource Allocation and Management', 'Production Planning'], 'domains': ['Manufacturing and Production', 'Food and Beverage']}",A breakfast joint makes two different sandwiches: a regular and a special. Both need eggs and bacon. Each regular sandwich requires EggsPerRegular eggs and BaconPerRegular slices of bacon. Each special sandwich requires EggsPerSpecial eggs and BaconPerSpecial slices of bacon. The joint has a total of TotalEggs eggs and TotalBacon slices of bacon. It makes a profit of ProfitRegular per regular sandwich and a profit of ProfitSpecial per special sandwich. How many of each sandwich should be made to maximize profit?,2
4,"""The goal is to maximize the total profit from producing regular and special sandwiches""",$\max (\text{ProfitRegular} \times x + \text{ProfitSpecial} \times y)$,The total number of bacon slices used by regular and special sandwiches should not exceed the total number of bacon slices available,$x \times \text{BaconRegular} + y \times \text{BaconSpecial} \leq \text{TotalBacon}$,"{'types': ['Resource Allocation and Management', 'Production Planning'], 'domains': ['Manufacturing and Production', 'Food and Beverage']}",A breakfast joint makes two different sandwiches: a regular and a special. Both need eggs and bacon. Each regular sandwich requires EggsPerRegular eggs and BaconPerRegular slices of bacon. Each special sandwich requires EggsPerSpecial eggs and BaconPerSpecial slices of bacon. The joint has a total of TotalEggs eggs and TotalBacon slices of bacon. It makes a profit of ProfitRegular per regular sandwich and a profit of ProfitSpecial per special sandwich. How many of each sandwich should be made to maximize profit?,2
5,"""The goal is to maximize the exposure for the new product by determining the optimal number of radio and social media advertisements within the budget and given constraints.""",$\max \text{ExposureRadioAd} \times \text{numRadioAds} + \text{ExposureSocialMediaAd} \times \text{numSocialMediaAds}$,Total cost of radio ads and social media ads should not exceed the TotalBudget,$CostRadioAd \\times numRadioAds + CostSocialMediaAd \\times numSocialMediaAds \\leq TotalBudget$,"{'types': ['Resource Allocation and Management', 'Selection'], 'domains': ['Retail and E-commerce']}",A cleaning company aims to maximize exposure for promoting their new product without exceeding their TotalBudget. They will advertise using radio ads and social media ads. Each radio ad costs CostRadioAd and provides ExposureRadioAd exposure. Each social media ad costs CostSocialMediaAd and delivers ExposureSocialMediaAd exposure. The company aims to run between MinRadioAds and MaxRadioAds radio ads and at least MinSocialMediaAds social media ads while staying within the TotalBudget.,3
6,"""The goal is to maximize the exposure for the new product by determining the optimal number of radio and social media advertisements within the budget and given constraints.""",$\max \text{ExposureRadioAd} \times \text{numRadioAds} + \text{ExposureSocialMediaAd} \times \text{numSocialMediaAds}$,The number of radio advertisements should be at least MinRadioAds,$\\text{numRadioAds} \\ge \\text{MinRadioAds}$,"{'types': ['Resource Allocation and Management', 'Selection'], 'domains': ['Retail and E-commerce']}",A cleaning company aims to maximize exposure for promoting their new product without exceeding their TotalBudget. They will advertise using radio ads and social media ads. Each radio ad costs CostRadioAd and provides ExposureRadioAd exposure. Each social media ad costs CostSocialMediaAd and delivers ExposureSocialMediaAd exposure. The company aims to run between MinRadioAds and MaxRadioAds radio ads and at least MinSocialMediaAds social media ads while staying within the TotalBudget.,3
7,"""The goal is to maximize the exposure for the new product by determining the optimal number of radio and social media advertisements within the budget and given constraints.""",$\max \text{ExposureRadioAd} \times \text{numRadioAds} + \text{ExposureSocialMediaAd} \times \text{numSocialMediaAds}$,The number of radio advertisements should not exceed MaxRadioAds,$numRadioAds \\leq MaxRadioAds$,"{'types': ['Resource Allocation and Management', 'Selection'], 'domains': ['Retail and E-commerce']}",A cleaning company aims to maximize exposure for promoting their new product without exceeding their TotalBudget. They will advertise using radio ads and social media ads. Each radio ad costs CostRadioAd and provides ExposureRadioAd exposure. Each social media ad costs CostSocialMediaAd and delivers ExposureSocialMediaAd exposure. The company aims to run between MinRadioAds and MaxRadioAds radio ads and at least MinSocialMediaAds social media ads while staying within the TotalBudget.,3
8,"""The goal is to maximize the exposure for the new product by determining the optimal number of radio and social media advertisements within the budget and given constraints.""",$\max \text{ExposureRadioAd} \times \text{numRadioAds} + \text{ExposureSocialMediaAd} \times \text{numSocialMediaAds}$,The number of social media advertisements should be at least MinSocialMediaAds,$\text{numSocialMediaAds} \geq \text{MinSocialMediaAds}$,"{'types': ['Resource Allocation and Management', 'Selection'], 'domains': ['Retail and E-commerce']}",A cleaning company aims to maximize exposure for promoting their new product without exceeding their TotalBudget. They will advertise using radio ads and social media ads. Each radio ad costs CostRadioAd and provides ExposureRadioAd exposure. Each social media ad costs CostSocialMediaAd and delivers ExposureSocialMediaAd exposure. The company aims to run between MinRadioAds and MaxRadioAds radio ads and at least MinSocialMediaAds social media ads while staying within the TotalBudget.,3
9,"""The goal is to maximize the profit from producing long and short cables""",$\max (\text{ProfitPerLongCable} \times \text{longCables} + \text{ProfitPerShortCable} \times \text{shortCables})$,The total gold used for making long and short cables should not exceed TotalGold,$GoldPerLongCable \cdot longCables + GoldPerShortCable \cdot shortCables \leq TotalGold$,"{'types': ['Resource Allocation and Management', 'Production Planning'], 'domains': ['Manufacturing and Production', 'Supply Chain Management']}","There is TotalGold available that is needed to make long and short cables. Long cables require GoldPerLongCable while short cables require GoldPerShortCable. Because of their compact size, the number of short cables should be at least ShortCableMultiplier times the number of long cables. In addition, there needs to be at least MinLongCables made. If each long cable sold results in a ProfitPerLongCable and each short cable sold results in a ProfitPerShortCable, how many of each type of cable should be made to maximize profit?",4
10,"""The goal is to maximize the profit from producing long and short cables""",$\max (\text{ProfitPerLongCable} \times \text{longCables} + \text{ProfitPerShortCable} \times \text{shortCables})$,The number of short cables should be at least ShortCableMultiplier times the number of long cables,$\\text{shortCables} \\geq \\text{ShortCableMultiplier} \\cdot \\text{longCables}$,"{'types': ['Resource Allocation and Management', 'Production Planning'], 'domains': ['Manufacturing and Production', 'Supply Chain Management']}","There is TotalGold available that is needed to make long and short cables. Long cables require GoldPerLongCable while short cables require GoldPerShortCable. Because of their compact size, the number of short cables should be at least ShortCableMultiplier times the number of long cables. In addition, there needs to be at least MinLongCables made. If each long cable sold results in a ProfitPerLongCable and each short cable sold results in a ProfitPerShortCable, how many of each type of cable should be made to maximize profit?",4
11,"""The goal is to maximize the profit from producing long and short cables""",$\max (\text{ProfitPerLongCable} \times \text{longCables} + \text{ProfitPerShortCable} \times \text{shortCables})$,The number of long cables made should be at least MinLongCables,$longCables \geq MinLongCables$,"{'types': ['Resource Allocation and Management', 'Production Planning'], 'domains': ['Manufacturing and Production', 'Supply Chain Management']}","There is TotalGold available that is needed to make long and short cables. Long cables require GoldPerLongCable while short cables require GoldPerShortCable. Because of their compact size, the number of short cables should be at least ShortCableMultiplier times the number of long cables. In addition, there needs to be at least MinLongCables made. If each long cable sold results in a ProfitPerLongCable and each short cable sold results in a ProfitPerShortCable, how many of each type of cable should be made to maximize profit?",4
12,"""The goal is to determine the number of advertisements on each type of media to maximize the total audience while adhering to these constraints.""",$\max \text{numAdsZTube} \cdot \text{ViewersZTube} + \text{numAdsSoorchle} \cdot \text{ViewersSoorchle} + \text{numAdsWassa} \cdot \text{ViewersWassa}$,"Total cost of advertisements on all media types (ZTube, Soorchle, Wassa) should not exceed the weekly advertising budget",$CostZTube \times numAdsZTube + CostSoorchle \times numAdsSoorchle + CostWassa \times numAdsWassa \leq Budget$,"{'types': ['Resource Allocation and Management', 'Portfolio Optimization'], 'domains': ['Retail and E-commerce', 'Marketing and Media']}","A company is deciding where to promote their product across NumMedia types of media. Each medium has a cost and a number of viewers it attracts per advertisement, defined by CostMedia and ViewersMedia respectively. SzoorchleEngine has a maximum number of advertisements constraint, MaxSzoorchleAds. To balance advertising, at most MaxWassaProportion of the total number of ads should be on Wassa, and at least MinZTubeProportion of the total number of ads should be on ZTube. The total weekly advertising budget is defined by Budget. The goal is to determine the number of advertisements on each type of media to maximize the total audience while adhering to these constraints.",6
13,"""The goal is to determine the number of advertisements on each type of media to maximize the total audience while adhering to these constraints.""",$\max \text{numAdsZTube} \cdot \text{ViewersZTube} + \text{numAdsSoorchle} \cdot \text{ViewersSoorchle} + \text{numAdsWassa} \cdot \text{ViewersWassa}$,Number of advertisements on SoorchleEngine should not exceed MaxSzoorchleAds,$numAdsSoorchle \leq MaxAdsSoorchle$,"{'types': ['Resource Allocation and Management', 'Portfolio Optimization'], 'domains': ['Retail and E-commerce', 'Marketing and Media']}","A company is deciding where to promote their product across NumMedia types of media. Each medium has a cost and a number of viewers it attracts per advertisement, defined by CostMedia and ViewersMedia respectively. SzoorchleEngine has a maximum number of advertisements constraint, MaxSzoorchleAds. To balance advertising, at most MaxWassaProportion of the total number of ads should be on Wassa, and at least MinZTubeProportion of the total number of ads should be on ZTube. The total weekly advertising budget is defined by Budget. The goal is to determine the number of advertisements on each type of media to maximize the total audience while adhering to these constraints.",6
14,"""The goal is to determine the number of advertisements on each type of media to maximize the total audience while adhering to these constraints.""",$\max \text{numAdsZTube} \cdot \text{ViewersZTube} + \text{numAdsSoorchle} \cdot \text{ViewersSoorchle} + \text{numAdsWassa} \cdot \text{ViewersWassa}$,Proportion of total number of advertisements on Wassa should not exceed MaxWassaProportion,$\text{numAdsWassa} \leq \text{MaxWassaProportion} \times (\text{numAdsWassa} + \text{numAdsZTube} + \text{numAdsSoorchle})$,"{'types': ['Resource Allocation and Management', 'Portfolio Optimization'], 'domains': ['Retail and E-commerce', 'Marketing and Media']}","A company is deciding where to promote their product across NumMedia types of media. Each medium has a cost and a number of viewers it attracts per advertisement, defined by CostMedia and ViewersMedia respectively. SzoorchleEngine has a maximum number of advertisements constraint, MaxSzoorchleAds. To balance advertising, at most MaxWassaProportion of the total number of ads should be on Wassa, and at least MinZTubeProportion of the total number of ads should be on ZTube. The total weekly advertising budget is defined by Budget. The goal is to determine the number of advertisements on each type of media to maximize the total audience while adhering to these constraints.",6
15,"""The goal is to determine the number of advertisements on each type of media to maximize the total audience while adhering to these constraints.""",$\max \text{numAdsZTube} \cdot \text{ViewersZTube} + \text{numAdsSoorchle} \cdot \text{ViewersSoorchle} + \text{numAdsWassa} \cdot \text{ViewersWassa}$,Proportion of total number of advertisements on ZTube should be at least MinZTubeProportion,$\\text{numAdsZTube} \\geq \\text{MinFractionZTube} \\times (\\text{numAdsZTube} + \\text{numAdsSoorchle} + \\text{numAdsWassa})$,"{'types': ['Resource Allocation and Management', 'Portfolio Optimization'], 'domains': ['Retail and E-commerce', 'Marketing and Media']}","A company is deciding where to promote their product across NumMedia types of media. Each medium has a cost and a number of viewers it attracts per advertisement, defined by CostMedia and ViewersMedia respectively. SzoorchleEngine has a maximum number of advertisements constraint, MaxSzoorchleAds. To balance advertising, at most MaxWassaProportion of the total number of ads should be on Wassa, and at least MinZTubeProportion of the total number of ads should be on ZTube. The total weekly advertising budget is defined by Budget. The goal is to determine the number of advertisements on each type of media to maximize the total audience while adhering to these constraints.",6
16,The goal is to maximize the total profit from producing chairs and dressers.,$\max (\text{ProfitChair} \times \text{numChairs} + \text{ProfitDresser} \times \text{numDressers})$,The total amount of stain used for chairs plus the total amount of stain used for dressers should not exceed the total gallons of stain available per week,$numChairs \times StainPerChair + numDressers \times StainPerDresser \leq TotalStain$,"{'types': ['Resource Allocation and Management', 'Production Planning'], 'domains': ['Manufacturing and Production', 'Supply Chain Management']}","A furniture company produces two types of products, chairs and dressers. The profit from each chair is ChairProfit, while the profit from each dresser is DresserProfit. Every week, the company has TotalStain gallons of stain and TotalOakWood lengths of oak wood available. Each chair requires StainPerChair gallons of stain and WoodPerChair lengths of oak wood, while each dresser requires StainPerDresser gallons of stain and WoodPerDresser lengths of oak wood. The goal is to determine the number of chairs and dressers to produce in order to maximize the total profit, given the constraints on the availability of stain and oak wood.",7
17,The goal is to maximize the total profit from producing chairs and dressers.,$\max (\text{ProfitChair} \times \text{numChairs} + \text{ProfitDresser} \times \text{numDressers})$,The total lengths of oak wood used for chairs plus the total lengths of oak wood used for dressers should not exceed the total lengths of oak wood available per week,$\\text{numChairs} \\times \\text{OakWoodPerChair} + \\text{numDressers} \\times \\text{OakWoodPerDresser} \\leq \\text{TotalOakWood}$,"{'types': ['Resource Allocation and Management', 'Production Planning'], 'domains': ['Manufacturing and Production', 'Supply Chain Management']}","A furniture company produces two types of products, chairs and dressers. The profit from each chair is ChairProfit, while the profit from each dresser is DresserProfit. Every week, the company has TotalStain gallons of stain and TotalOakWood lengths of oak wood available. Each chair requires StainPerChair gallons of stain and WoodPerChair lengths of oak wood, while each dresser requires StainPerDresser gallons of stain and WoodPerDresser lengths of oak wood. The goal is to determine the number of chairs and dressers to produce in order to maximize the total profit, given the constraints on the availability of stain and oak wood.",7
18,"""The goal is to minimize the cost of the mixture of Feed A and Feed B while meeting the required minimum units of protein and fat.""",$\min \left( \text{CostFeedA} \times x_A + \text{CostFeedB} \times x_B \right)$,The mixture must contain at least MinProtein units of protein,$ProteinFeedA \times xA + ProteinFeedB \times xB \geq MinProtein$,"{'types': ['Blending'], 'domains': ['Agriculture and Forestry', 'Food and Beverage']}","A farmer wants to mix his animal feeds, Feed A and Feed B, in such a way that the mixture will contain a minimum of MinProtein units of protein and MinFat units of fat. Feed A costs CostFeedA per kilogram and contains ProteinFeedA units of protein and FatFeedA units of fat. Feed B costs CostFeedB per kilogram and contains ProteinFeedB units of protein and FatFeedB units of fat. Determine the minimum cost of the mixture.",8
19,"""The goal is to minimize the cost of the mixture of Feed A and Feed B while meeting the required minimum units of protein and fat.""",$\min \left( \text{CostFeedA} \times x_A + \text{CostFeedB} \times x_B \right)$,The mixture must contain at least MinFat units of fat,$FatFeedA \\cdot xA + FatFeedB \\cdot xB \\geq FatMin$,"{'types': ['Blending'], 'domains': ['Agriculture and Forestry', 'Food and Beverage']}","A farmer wants to mix his animal feeds, Feed A and Feed B, in such a way that the mixture will contain a minimum of MinProtein units of protein and MinFat units of fat. Feed A costs CostFeedA per kilogram and contains ProteinFeedA units of protein and FatFeedA units of fat. Feed B costs CostFeedB per kilogram and contains ProteinFeedB units of protein and FatFeedB units of fat. Determine the minimum cost of the mixture.",8
20,"""The goal is to maximize the total profit from producing terracotta jars""",$\max ProfitThinJar \cdot numThinJars + ProfitStubbyJar \cdot numStubbyJars$,Total shaping time for all thin jars and stubby jars should not exceed TotalShapingTime minutes,$ShapingTimeThinJar \\times numThinJars + ShapingTimeStubbyJar \\times numStubbyJars \\leq TotalShapingTime$,"{'types': ['Resource Allocation and Management', 'Production Planning'], 'domains': ['Manufacturing and Production']}","An artisan makes two types of terracotta jars: a thin jar and a stubby jar. Each thin jar requires ShapingTimeThinJar minutes of shaping time and BakingTimeThinJar minutes of baking time. Each stubby jar requires ShapingTimeStubbyJar minutes of shaping time and BakingTimeStubbyJar minutes of baking time. Per week, there are TotalShapingTime minutes available for shaping and TotalBakingTime minutes available for baking. The profit per thin jar is ProfitThinJar and the profit per stubby jar is ProfitStubbyJar. How many jars of each type should the artisan make to maximize profit?",9
21,"""The goal is to maximize the total profit from producing terracotta jars""",$\max ProfitThinJar \cdot numThinJars + ProfitStubbyJar \cdot numStubbyJars$,Total baking time for all thin jars and stubby jars should not exceed TotalBakingTime minutes,$numThinJars \times BakingTimeThinJar + numStubbyJars \times BakingTimeStubbyJar \leq TotalBakingTime$,"{'types': ['Resource Allocation and Management', 'Production Planning'], 'domains': ['Manufacturing and Production']}","An artisan makes two types of terracotta jars: a thin jar and a stubby jar. Each thin jar requires ShapingTimeThinJar minutes of shaping time and BakingTimeThinJar minutes of baking time. Each stubby jar requires ShapingTimeStubbyJar minutes of shaping time and BakingTimeStubbyJar minutes of baking time. Per week, there are TotalShapingTime minutes available for shaping and TotalBakingTime minutes available for baking. The profit per thin jar is ProfitThinJar and the profit per stubby jar is ProfitStubbyJar. How many jars of each type should the artisan make to maximize profit?",9
22,"""The goal is to maximize the total profit from preparing banana-haters packages and combo packages""",$\max \big( \text{ProfitBananaHatersPackage} \times \text{quantityBananaHatersPackages} + \text{ProfitComboPackage} \times \text{quantityComboPackages} \big)$,The total number of apples used in banana-haters packages and combo packages should not exceed the stock of apples,$ApplesInBananaHatersPackage \times quantityBananaHatersPackages + ApplesInComboPackage \times quantityComboPackages \leq StockApples$,"{'types': ['Resource Allocation and Management', 'Production Planning', 'Packaging'], 'domains': ['Retail and E-commerce', 'Food and Beverage', 'Supply Chain Management']}","A grocery store wants to liquidate its stock of TotalApples apples, TotalBananas bananas, and TotalGrapes grapes. Given past experience, the store knows that they can propose a banana-haters package with ApplesInBananaHaters apples and GrapesInBananaHaters grapes, and that this package will bring a profit of ProfitBananaHaters euros. Similarly, they can prepare a combo package with ApplesInCombo apples, BananasInCombo bananas, and GrapesInCombo grapes, yielding a profit of ProfitCombo euros. They know they can sell any quantity of these two packages within the availability of its stock. What quantity of each package, banana-haters packages and combo packages, should the store prepare to maximize net profit?",10
