,objective_description,objective_formulation,constraint_description,constraint_formulation,labels,description,problem_name
338,"""The objective is to minimize the total amount of time needed to transport a certain number of ducks using two transportation methods: boats and canoes.""",$\min (BoatTripTime \cdot boatTrips + CanoeTripTime \cdot canoeTrips)$,The total number of ducks taken to shore by boats and canoes should be at least MinDucksToShore,$boatTrips \times BoatDucksPerTrip + canoeTrips \times CanoeDucksPerTrip \geq MinDucksToShore$,"{'types': ['Resource Allocation and Management', 'Routing', 'Scheduling'], 'domains': ['Transportation & Logistics']}","The objective is to minimize the total amount of time needed to transport a certain number of ducks using two transportation methods: boats and canoes. Each boat can take BoatDucksPerTrip ducks per trip and takes BoatTripTime minutes per trip. Each canoe can take CanoeDucksPerTrip ducks per trip and takes CanoeTripTime minutes per trip. There is a maximum limit of MaxBoatTrips boat trips allowed, and at least MinCanoeTripPercentage percent of the total trips should be by canoe. Additionally, at least MinDucksToShore ducks need to be taken to shore.",142
339,"""The objective is to minimize the total amount of time needed to transport a certain number of ducks using two transportation methods: boats and canoes.""",$\min (BoatTripTime \cdot boatTrips + CanoeTripTime \cdot canoeTrips)$,The number of boat trips should not exceed MaxBoatTrips,$boatTrips \leq MaxBoatTrips$,"{'types': ['Resource Allocation and Management', 'Routing', 'Scheduling'], 'domains': ['Transportation & Logistics']}","The objective is to minimize the total amount of time needed to transport a certain number of ducks using two transportation methods: boats and canoes. Each boat can take BoatDucksPerTrip ducks per trip and takes BoatTripTime minutes per trip. Each canoe can take CanoeDucksPerTrip ducks per trip and takes CanoeTripTime minutes per trip. There is a maximum limit of MaxBoatTrips boat trips allowed, and at least MinCanoeTripPercentage percent of the total trips should be by canoe. Additionally, at least MinDucksToShore ducks need to be taken to shore.",142
340,"""The objective is to minimize the total amount of time needed to transport a certain number of ducks using two transportation methods: boats and canoes.""",$\min (BoatTripTime \cdot boatTrips + CanoeTripTime \cdot canoeTrips)$,At least MinCanoeTripPercentage percent of the total trips should be by canoe,$\\text{canoeTrips} \\geq \\frac{\\frac{\\text{MinCanoeTripPercentage}}{100} \\times \\text{boatTrips}}{1 - \\frac{\\text{MinCanoeTripPercentage}}{100}}$,"{'types': ['Resource Allocation and Management', 'Routing', 'Scheduling'], 'domains': ['Transportation & Logistics']}","The objective is to minimize the total amount of time needed to transport a certain number of ducks using two transportation methods: boats and canoes. Each boat can take BoatDucksPerTrip ducks per trip and takes BoatTripTime minutes per trip. Each canoe can take CanoeDucksPerTrip ducks per trip and takes CanoeTripTime minutes per trip. There is a maximum limit of MaxBoatTrips boat trips allowed, and at least MinCanoeTripPercentage percent of the total trips should be by canoe. Additionally, at least MinDucksToShore ducks need to be taken to shore.",142
341,"""The goal is to minimize the total amount of pollution produced by using old and new vans to deliver at least the minimum required number of soda bottles""",$\min \left( \text{PollutionOldVan} \cdot \text{oldVans} + \text{PollutionNewVan} \cdot \text{newVans} \right)$,The total number of soda bottles delivered by old and new vans should be at least MinBottles,$oldVans \times CapacityOldVan + newVans \times CapacityNewVan \geq MinBottles$,"{'types': ['Resource Allocation and Management', 'Routing'], 'domains': ['Transportation & Logistics', 'Supply Chain Management', 'Retail and E-commerce']}","A soda company sends bottles of their soda to stores around the city in old and new vans. An old van can take CapacityOldVan soda bottles while a new van can take CapacityNewVan soda bottles. An old van produces PollutionOldVan units of pollution while a new van only produces PollutionNewVan units of pollution. The company needs to send at least MinBottles bottles. In addition, at most MaxNewVans new vans can be used. How many of each van should be used to minimize the total amount of pollution produced?",143
342,"""The goal is to minimize the total amount of pollution produced by using old and new vans to deliver at least the minimum required number of soda bottles""",$\min \left( \text{PollutionOldVan} \cdot \text{oldVans} + \text{PollutionNewVan} \cdot \text{newVans} \right)$,The number of new vans used should not exceed MaxNewVans,$newVans \leq MaxNewVans$,"{'types': ['Resource Allocation and Management', 'Routing'], 'domains': ['Transportation & Logistics', 'Supply Chain Management', 'Retail and E-commerce']}","A soda company sends bottles of their soda to stores around the city in old and new vans. An old van can take CapacityOldVan soda bottles while a new van can take CapacityNewVan soda bottles. An old van produces PollutionOldVan units of pollution while a new van only produces PollutionNewVan units of pollution. The company needs to send at least MinBottles bottles. In addition, at most MaxNewVans new vans can be used. How many of each van should be used to minimize the total amount of pollution produced?",143
343,"""The goal is to maximize the amount of lawn that can be mowed""",$\max (\text{numSmallTeams} \times \text{AreaSmallTeam} + \text{numLargeTeams} \times \text{AreaLargeTeam})$,The total number of employees used by small teams and large teams should not exceed the total number of employees available,$\\text{EmployeesPerSmallTeam} \\times \\text{numSmallTeams} + \\text{EmployeesPerLargeTeam} \\times \\text{numLargeTeams} \\leq \\text{TotalEmployees}$,"{'types': ['Resource Allocation and Management', 'Workforce Management', 'Scheduling'], 'domains': ['Manufacturing and Production', 'Supply Chain Management']}",A lawn mowing service provides neighborhood services using small teams and large teams. A small team requires EmployeesPerSmallTeam employees and can mow AreaSmallTeam sq ft of lawn. A large team requires EmployeesPerLargeTeam employees and can mow AreaLargeTeam sq ft of lawn. The company has TotalEmployees employees available. The number of small teams must be at least SmallTeamsFactor times the number of large teams. There must be at least MinLargeTeams large teams and at least MinSmallTeams small teams. How many of each team type should be used to maximize the amount of lawn that can be mowed?,144
344,"""The goal is to maximize the amount of lawn that can be mowed""",$\max (\text{numSmallTeams} \times \text{AreaSmallTeam} + \text{numLargeTeams} \times \text{AreaLargeTeam})$,The number of small teams should be at least SmallTeamsFactor times the number of large teams,$\\text{numSmallTeams} \\geq \\text{SmallTeamsFactor} \\cdot \\text{numLargeTeams}$,"{'types': ['Resource Allocation and Management', 'Workforce Management', 'Scheduling'], 'domains': ['Manufacturing and Production', 'Supply Chain Management']}",A lawn mowing service provides neighborhood services using small teams and large teams. A small team requires EmployeesPerSmallTeam employees and can mow AreaSmallTeam sq ft of lawn. A large team requires EmployeesPerLargeTeam employees and can mow AreaLargeTeam sq ft of lawn. The company has TotalEmployees employees available. The number of small teams must be at least SmallTeamsFactor times the number of large teams. There must be at least MinLargeTeams large teams and at least MinSmallTeams small teams. How many of each team type should be used to maximize the amount of lawn that can be mowed?,144
345,"""The goal is to maximize the amount of lawn that can be mowed""",$\max (\text{numSmallTeams} \times \text{AreaSmallTeam} + \text{numLargeTeams} \times \text{AreaLargeTeam})$,There must be at least MinLargeTeams large teams,$\\text{numLargeTeams} \\geq \\text{MinLargeTeams}$,"{'types': ['Resource Allocation and Management', 'Workforce Management', 'Scheduling'], 'domains': ['Manufacturing and Production', 'Supply Chain Management']}",A lawn mowing service provides neighborhood services using small teams and large teams. A small team requires EmployeesPerSmallTeam employees and can mow AreaSmallTeam sq ft of lawn. A large team requires EmployeesPerLargeTeam employees and can mow AreaLargeTeam sq ft of lawn. The company has TotalEmployees employees available. The number of small teams must be at least SmallTeamsFactor times the number of large teams. There must be at least MinLargeTeams large teams and at least MinSmallTeams small teams. How many of each team type should be used to maximize the amount of lawn that can be mowed?,144
346,"""The goal is to maximize the amount of lawn that can be mowed""",$\max (\text{numSmallTeams} \times \text{AreaSmallTeam} + \text{numLargeTeams} \times \text{AreaLargeTeam})$,There must be at least MinSmallTeams small teams,$\\text{numSmallTeams} \\geq \\text{MinSmallTeams}$,"{'types': ['Resource Allocation and Management', 'Workforce Management', 'Scheduling'], 'domains': ['Manufacturing and Production', 'Supply Chain Management']}",A lawn mowing service provides neighborhood services using small teams and large teams. A small team requires EmployeesPerSmallTeam employees and can mow AreaSmallTeam sq ft of lawn. A large team requires EmployeesPerLargeTeam employees and can mow AreaLargeTeam sq ft of lawn. The company has TotalEmployees employees available. The number of small teams must be at least SmallTeamsFactor times the number of large teams. There must be at least MinLargeTeams large teams and at least MinSmallTeams small teams. How many of each team type should be used to maximize the amount of lawn that can be mowed?,144
347,"""The goal is to maximize the amount of lawn that can be mowed""",$\max (\text{numSmallTeams} \times \text{AreaSmallTeam} + \text{numLargeTeams} \times \text{AreaLargeTeam})$,The total number of employees used by small teams is EmployeesPerSmallTeam multiplied by the number of small teams,$\text{EmployeesPerSmallTeam} \times \text{numSmallTeams}$,"{'types': ['Resource Allocation and Management', 'Workforce Management', 'Scheduling'], 'domains': ['Manufacturing and Production', 'Supply Chain Management']}",A lawn mowing service provides neighborhood services using small teams and large teams. A small team requires EmployeesPerSmallTeam employees and can mow AreaSmallTeam sq ft of lawn. A large team requires EmployeesPerLargeTeam employees and can mow AreaLargeTeam sq ft of lawn. The company has TotalEmployees employees available. The number of small teams must be at least SmallTeamsFactor times the number of large teams. There must be at least MinLargeTeams large teams and at least MinSmallTeams small teams. How many of each team type should be used to maximize the amount of lawn that can be mowed?,144
348,"""The goal is to maximize the amount of lawn that can be mowed""",$\max (\text{numSmallTeams} \times \text{AreaSmallTeam} + \text{numLargeTeams} \times \text{AreaLargeTeam})$,The total number of employees used by large teams is EmployeesPerLargeTeam multiplied by the number of large teams,$\\text{totalEmployeesUsedByLargeTeams} = \\text{EmployeesPerLargeTeam} \\times \\text{numLargeTeams}$,"{'types': ['Resource Allocation and Management', 'Workforce Management', 'Scheduling'], 'domains': ['Manufacturing and Production', 'Supply Chain Management']}",A lawn mowing service provides neighborhood services using small teams and large teams. A small team requires EmployeesPerSmallTeam employees and can mow AreaSmallTeam sq ft of lawn. A large team requires EmployeesPerLargeTeam employees and can mow AreaLargeTeam sq ft of lawn. The company has TotalEmployees employees available. The number of small teams must be at least SmallTeamsFactor times the number of large teams. There must be at least MinLargeTeams large teams and at least MinSmallTeams small teams. How many of each team type should be used to maximize the amount of lawn that can be mowed?,144
349,"""The goal is to maximize the total number of tricks that can be performed""",$\max \left(\text{otters} \times \text{OtterTricks} + \text{dolphins} \times \text{DolphinTricks}\right)$,At least MinDolphins dolphins must be used,$dolphins \geq \text{MinDolphins}$,"{'types': ['Resource Allocation and Management', 'Selection'], 'domains': ['Sports and Entertainment']}","An aquarium conducts shows using otters and dolphins. Each otter performs OtterTricks tricks and requires OtterTreats treats to do so. Each dolphin performs DolphinTricks trick and requires DolphinTreats treats to do so. Considering the popularity, at least MinDolphins dolphins must be used, and no more than MaxOtterPercentage of the performers can be otters. With a total of TotalTreats treats available, the task is to maximize the total number of tricks that can be performed.",145
350,"""The goal is to maximize the total number of tricks that can be performed""",$\max \left(\text{otters} \times \text{OtterTricks} + \text{dolphins} \times \text{DolphinTricks}\right)$,No more than MaxOtterPercentage of the performers can be otters,$\\text{otters} \\leq \\text{MaxOtterPercentage} \\times (\\text{otters} + \\text{dolphins})$,"{'types': ['Resource Allocation and Management', 'Selection'], 'domains': ['Sports and Entertainment']}","An aquarium conducts shows using otters and dolphins. Each otter performs OtterTricks tricks and requires OtterTreats treats to do so. Each dolphin performs DolphinTricks trick and requires DolphinTreats treats to do so. Considering the popularity, at least MinDolphins dolphins must be used, and no more than MaxOtterPercentage of the performers can be otters. With a total of TotalTreats treats available, the task is to maximize the total number of tricks that can be performed.",145
351,"""The goal is to maximize the total number of tricks that can be performed""",$\max \left(\text{otters} \times \text{OtterTricks} + \text{dolphins} \times \text{DolphinTricks}\right)$,Total number of treats used by otters and dolphins should not exceed TotalTreats,$\\text{otters} \\times \\text{OtterTreats} + \\text{dolphins} \\times \\text{DolphinTreats} \\leq \\text{TotalTreats}$,"{'types': ['Resource Allocation and Management', 'Selection'], 'domains': ['Sports and Entertainment']}","An aquarium conducts shows using otters and dolphins. Each otter performs OtterTricks tricks and requires OtterTreats treats to do so. Each dolphin performs DolphinTricks trick and requires DolphinTreats treats to do so. Considering the popularity, at least MinDolphins dolphins must be used, and no more than MaxOtterPercentage of the performers can be otters. With a total of TotalTreats treats available, the task is to maximize the total number of tricks that can be performed.",145
352,"""The goal is to minimize the total number of containers and trucks used""",$\min ( \text{numContainers} + \text{numTrucks} )$,The number of trucks used should be at most MaxTruckContainerRatio times the number of containers used,$numTrucks \\leq MaxTruckContainerRatio \\times numContainers$,"{'types': ['Resource Allocation and Management', 'Production Planning', 'Routing'], 'domains': ['Transportation & Logistics', 'Energy and Power Systems', 'Government and Public Sector']}","An oil and gas company is sending their oil to the port using containers and trucks. A container can hold ContainerCapacity units of oil while a truck can hold TruckCapacity units of oil. Due to government restrictions, the number of trucks used has to be at most MaxTruckContainerRatio times the number of containers used. If at least MinOilRequired units of oil need to be sent to the port and at least MinContainers containers need to be used, the objective is to minimize the total number of containers and trucks used.",147
353,"""The goal is to minimize the total number of containers and trucks used""",$\min ( \text{numContainers} + \text{numTrucks} )$,At least MinOilRequired units of oil need to be sent to the port,$numContainers \times ContainerCapacity + numTrucks \times TruckCapacity \geq MinOilRequired$,"{'types': ['Resource Allocation and Management', 'Production Planning', 'Routing'], 'domains': ['Transportation & Logistics', 'Energy and Power Systems', 'Government and Public Sector']}","An oil and gas company is sending their oil to the port using containers and trucks. A container can hold ContainerCapacity units of oil while a truck can hold TruckCapacity units of oil. Due to government restrictions, the number of trucks used has to be at most MaxTruckContainerRatio times the number of containers used. If at least MinOilRequired units of oil need to be sent to the port and at least MinContainers containers need to be used, the objective is to minimize the total number of containers and trucks used.",147
354,"""The goal is to minimize the total number of containers and trucks used""",$\min ( \text{numContainers} + \text{numTrucks} )$,At least MinContainers containers need to be used,$\\text{numContainers} \\geq \\text{MinContainers}$,"{'types': ['Resource Allocation and Management', 'Production Planning', 'Routing'], 'domains': ['Transportation & Logistics', 'Energy and Power Systems', 'Government and Public Sector']}","An oil and gas company is sending their oil to the port using containers and trucks. A container can hold ContainerCapacity units of oil while a truck can hold TruckCapacity units of oil. Due to government restrictions, the number of trucks used has to be at most MaxTruckContainerRatio times the number of containers used. If at least MinOilRequired units of oil need to be sent to the port and at least MinContainers containers need to be used, the objective is to minimize the total number of containers and trucks used.",147
355,The goal is to minimize the total number of buses hired.,$\min (\text{numSmallBuses} + \text{numLargeBuses})$,The total number of students transported by all hired buses should be at least MinStudents,$\text{SmallBusCapacity} \cdot \text{numSmallBuses} + \text{LargeBusCapacity} \cdot \text{numLargeBuses} \geq \text{MinStudents}$,"{'types': ['Resource Allocation and Management', 'Scheduling'], 'domains': ['Transportation & Logistics', 'Education']}","A school is organizing a field trip and plans to hire buses of two types. One type of bus has a capacity of SmallBusCapacity students, and the other type has a capacity of LargeBusCapacity students. The school needs to provide transportation for at least MinStudents students. In addition, no more than a fraction MaxLargeBusPercentage of the total number of hired buses can be large buses. The objective is to determine the number of each type of bus to hire to minimize the total number of buses.",148
356,The goal is to minimize the total number of buses hired.,$\min (\text{numSmallBuses} + \text{numLargeBuses})$,The fraction of large buses hired should not exceed MaxLargeBusPercentage of the total number of hired buses,$\\text{numLargeBuses} \\leq \\frac{\\text{MaxLargeBusPercentage} \\times \\text{numSmallBuses}}{1 - \\text{MaxLargeBusPercentage}}$,"{'types': ['Resource Allocation and Management', 'Scheduling'], 'domains': ['Transportation & Logistics', 'Education']}","A school is organizing a field trip and plans to hire buses of two types. One type of bus has a capacity of SmallBusCapacity students, and the other type has a capacity of LargeBusCapacity students. The school needs to provide transportation for at least MinStudents students. In addition, no more than a fraction MaxLargeBusPercentage of the total number of hired buses can be large buses. The objective is to determine the number of each type of bus to hire to minimize the total number of buses.",148
357,"""The goal is to minimize the total number of trips required to ship the patties""","$\min \, (x + y)$",The total number of patties shipped by trucks and vans must be at least MinPatties,$\\text{TruckCapacity} \\times x + \\text{VanCapacity} \\times y \\geq \\text{MinPatties}$,"{'types': ['Resource Allocation and Management', 'Production Planning', 'Routing'], 'domains': ['Transportation & Logistics', 'Supply Chain Management', 'Food and Beverage']}",A meat shop ships their burger patties using refrigerated trucks and vans. Each truck can take TruckCapacity patties at a cost of TruckCost per trip. Each van can take VanCapacity patties at a cost of VanCost per trip. The number of trucks must not exceed the number of vans. The meat shop has to ship at least MinPatties patties and they have a maximum budget of MaxBudget. How should they plan their shipment to minimize the total number of trips?,149
358,"""The goal is to minimize the total number of trips required to ship the patties""","$\min \, (x + y)$",The total cost of shipping patties using trucks and vans must not exceed MaxBudget,$TruckCost \\cdot x + VanCost \\cdot y \\leq MaxBudget$,"{'types': ['Resource Allocation and Management', 'Production Planning', 'Routing'], 'domains': ['Transportation & Logistics', 'Supply Chain Management', 'Food and Beverage']}",A meat shop ships their burger patties using refrigerated trucks and vans. Each truck can take TruckCapacity patties at a cost of TruckCost per trip. Each van can take VanCapacity patties at a cost of VanCost per trip. The number of trucks must not exceed the number of vans. The meat shop has to ship at least MinPatties patties and they have a maximum budget of MaxBudget. How should they plan their shipment to minimize the total number of trips?,149
359,"""The goal is to minimize the total number of trips required to ship the patties""","$\min \, (x + y)$",The number of trucks used should not exceed the number of vans used,$x \leq y$,"{'types': ['Resource Allocation and Management', 'Production Planning', 'Routing'], 'domains': ['Transportation & Logistics', 'Supply Chain Management', 'Food and Beverage']}",A meat shop ships their burger patties using refrigerated trucks and vans. Each truck can take TruckCapacity patties at a cost of TruckCost per trip. Each van can take VanCapacity patties at a cost of VanCost per trip. The number of trucks must not exceed the number of vans. The meat shop has to ship at least MinPatties patties and they have a maximum budget of MaxBudget. How should they plan their shipment to minimize the total number of trips?,149
360,"""The goal is to determine the number of each bouquet type he should transport to maximize the total number of flowers that reach the stores""",$\max (SmallBouquetFlowers \cdot smallBouquetsTransported + LargeBouquetFlowers \cdot largeBouquetsTransported)$,The number of small bouquets transported should not exceed MaxSmallBouquets,$smallBouquetsTransported \leq MaxSmallBouquets$,"{'types': ['Resource Allocation and Management', 'Production Planning', 'Sizing'], 'domains': ['Retail and E-commerce', 'Transportation & Logistics', 'Supply Chain Management']}","A florist transports his flowers to stores in small bouquets and large bouquets. Each small bouquet has SmallBouquetFlowers flowers while each large bouquet has LargeBouquetFlowers flowers. The florist can transport at most MaxSmallBouquets small bouquets and MaxLargeBouquets large bouquets. In total, he can transport at most MaxTotalBouquets bouquets, and he must transport at least MinLargeBouquets large bouquets. Additionally, he must transport at least SmallLargeRatio times the number of large bouquets as small bouquets. The goal is to determine the number of each bouquet type he should transport to maximize the total number of flowers that reach the stores.",150
361,"""The goal is to determine the number of each bouquet type he should transport to maximize the total number of flowers that reach the stores""",$\max (SmallBouquetFlowers \cdot smallBouquetsTransported + LargeBouquetFlowers \cdot largeBouquetsTransported)$,The number of large bouquets transported should not exceed MaxLargeBouquets,$largeBouquetsTransported \leq MaxLargeBouquets$,"{'types': ['Resource Allocation and Management', 'Production Planning', 'Sizing'], 'domains': ['Retail and E-commerce', 'Transportation & Logistics', 'Supply Chain Management']}","A florist transports his flowers to stores in small bouquets and large bouquets. Each small bouquet has SmallBouquetFlowers flowers while each large bouquet has LargeBouquetFlowers flowers. The florist can transport at most MaxSmallBouquets small bouquets and MaxLargeBouquets large bouquets. In total, he can transport at most MaxTotalBouquets bouquets, and he must transport at least MinLargeBouquets large bouquets. Additionally, he must transport at least SmallLargeRatio times the number of large bouquets as small bouquets. The goal is to determine the number of each bouquet type he should transport to maximize the total number of flowers that reach the stores.",150
