,objective_description,objective_formulation,constraint_description,constraint_formulation,labels,description,problem_name
544,"""The goal is to maximize the total number of units (cans and bottles) produced.""",$\max ( \text{numCans} + \text{numBottles} )$,At least MinBottles glass bottles must be produced,$numBottles \\geq MinBottles$,"{'types': ['Production Planning', 'Resource Allocation and Management'], 'domains': ['Manufacturing and Production', 'Food and Beverage']}","A soda company needs to bottle at least MinTotalVolume of soda every day. A can holds VolumeCan of soda whereas a bottle holds VolumeBottle of soda. The number of cans must be at least MinRatioCansToBottles times the number of glass bottles, and at least MinBottles glass bottles must be produced due to contracts. How many cans and bottles should be made to maximize the total number of units produced?",240
545,"""The goal is to minimize the total number of trips required for transporting the candles.""",$ \min (\text{freightTrips} + \text{airTrips}) $,Total cost of trips should not exceed the budget: FreightCost * number of freight trips + AirCost * number of air trips <= Budget,$FreightCost \\times freightTrips + AirCost \\times airTrips \\leq Budget$,"{'types': ['Resource Allocation and Management', 'Scheduling'], 'domains': ['Transportation & Logistics', 'Manufacturing and Production', 'Supply Chain Management']}","A candle-making company can move their inventory of candles using freight and air. Freight can transport TonsPerFreight tons per trip while using air can transport TonsPerAir tons per trip. Since freight takes longer, the cost for each freight trip is FreightCost while the cost over air for each trip is AirCost. The company needs to transport at least TotalTons tons of candles and they have a budget of Budget. Additionally, due to some urgent orders, at least MinAirPercentage of total tons must be transported through air. There must also be at least MinFreightTrips trips through freight. How many of trip by each should be scheduled to minimize the total number of trips?",241
546,"""The goal is to minimize the total number of trips required for transporting the candles.""",$ \min (\text{freightTrips} + \text{airTrips}) $,Total tons transported must be at least TotalTons: TonsPerFreight * number of freight trips + TonsPerAir * number of air trips >= TotalTons,$TonsPerFreight \\times freightTrips + TonsPerAir \\times airTrips \\geq TotalTons$,"{'types': ['Resource Allocation and Management', 'Scheduling'], 'domains': ['Transportation & Logistics', 'Manufacturing and Production', 'Supply Chain Management']}","A candle-making company can move their inventory of candles using freight and air. Freight can transport TonsPerFreight tons per trip while using air can transport TonsPerAir tons per trip. Since freight takes longer, the cost for each freight trip is FreightCost while the cost over air for each trip is AirCost. The company needs to transport at least TotalTons tons of candles and they have a budget of Budget. Additionally, due to some urgent orders, at least MinAirPercentage of total tons must be transported through air. There must also be at least MinFreightTrips trips through freight. How many of trip by each should be scheduled to minimize the total number of trips?",241
547,"""The goal is to minimize the total number of trips required for transporting the candles.""",$ \min (\text{freightTrips} + \text{airTrips}) $,At least MinAirPercentage of the total tons must be transported by air: TonsPerAir * number of air trips >= MinAirPercentage * TotalTons,$TonsPerAir \times airTrips \geq MinAirPercentage \times TotalTons$,"{'types': ['Resource Allocation and Management', 'Scheduling'], 'domains': ['Transportation & Logistics', 'Manufacturing and Production', 'Supply Chain Management']}","A candle-making company can move their inventory of candles using freight and air. Freight can transport TonsPerFreight tons per trip while using air can transport TonsPerAir tons per trip. Since freight takes longer, the cost for each freight trip is FreightCost while the cost over air for each trip is AirCost. The company needs to transport at least TotalTons tons of candles and they have a budget of Budget. Additionally, due to some urgent orders, at least MinAirPercentage of total tons must be transported through air. There must also be at least MinFreightTrips trips through freight. How many of trip by each should be scheduled to minimize the total number of trips?",241
548,"""The goal is to minimize the total number of trips required for transporting the candles.""",$ \min (\text{freightTrips} + \text{airTrips}) $,There must be at least MinFreightTrips trips through freight: number of freight trips >= MinFreightTrips,$freightTrips \\geq MinFreightTrips$,"{'types': ['Resource Allocation and Management', 'Scheduling'], 'domains': ['Transportation & Logistics', 'Manufacturing and Production', 'Supply Chain Management']}","A candle-making company can move their inventory of candles using freight and air. Freight can transport TonsPerFreight tons per trip while using air can transport TonsPerAir tons per trip. Since freight takes longer, the cost for each freight trip is FreightCost while the cost over air for each trip is AirCost. The company needs to transport at least TotalTons tons of candles and they have a budget of Budget. Additionally, due to some urgent orders, at least MinAirPercentage of total tons must be transported through air. There must also be at least MinFreightTrips trips through freight. How many of trip by each should be scheduled to minimize the total number of trips?",241
549,"""The goal is to minimize the total number of parking spots required by this production""",$\min ( \text{numLargeUnits} \times \text{LargeUnitParkingSpots} + \text{numSmallUnits} \times \text{SmallUnitParkingSpots} )$,The total number of people transported by large and small mobile production units must be at least TotalPeople.,$\\text{numLargeUnits} \\cdot \\text{LargeUnitCapacity} + \\text{numSmallUnits} \\cdot \\text{SmallUnitCapacity} \\geq \\text{TotalPeople}$,"{'types': ['Resource Allocation and Management', 'Production Planning'], 'domains': ['Transportation & Logistics', 'Manufacturing and Production']}","A production company needs to transport TotalPeople using large mobile production units or small mobile production units. Large mobile production units can hold LargeUnitCapacity people and take up LargeUnitParkingSpots parking spots whereas small mobile production units can hold SmallUnitCapacity people and take up SmallUnitParkingSpots parking spots. Movie stars prefer to have their small mobile production unit to share with a close staff, therefore at least MinSmallUnits units must be small mobile units. However, due to logistic limitations, large mobile production units are more space efficient per spot, they must make up at least MinPercentageLargeUnits of all vehicles. Minimize the total number of parking spots required by this production.",242
550,"""The goal is to minimize the total number of parking spots required by this production""",$\min ( \text{numLargeUnits} \times \text{LargeUnitParkingSpots} + \text{numSmallUnits} \times \text{SmallUnitParkingSpots} )$,The total number of small mobile production units must be at least MinSmallUnits.,$\\text{numSmallUnits} \\geq \\text{MinSmallUnits}$,"{'types': ['Resource Allocation and Management', 'Production Planning'], 'domains': ['Transportation & Logistics', 'Manufacturing and Production']}","A production company needs to transport TotalPeople using large mobile production units or small mobile production units. Large mobile production units can hold LargeUnitCapacity people and take up LargeUnitParkingSpots parking spots whereas small mobile production units can hold SmallUnitCapacity people and take up SmallUnitParkingSpots parking spots. Movie stars prefer to have their small mobile production unit to share with a close staff, therefore at least MinSmallUnits units must be small mobile units. However, due to logistic limitations, large mobile production units are more space efficient per spot, they must make up at least MinPercentageLargeUnits of all vehicles. Minimize the total number of parking spots required by this production.",242
551,"""The goal is to minimize the total number of parking spots required by this production""",$\min ( \text{numLargeUnits} \times \text{LargeUnitParkingSpots} + \text{numSmallUnits} \times \text{SmallUnitParkingSpots} )$,The number of large mobile production units must be at least MinPercentageLargeUnits percent of the total number of mobile production units.,$\\text{numLargeUnits} \\geq \\frac{\\text{MinPercentageLargeUnits}}{(1 - \\text{MinPercentageLargeUnits})} \\times \\text{numSmallUnits}$,"{'types': ['Resource Allocation and Management', 'Production Planning'], 'domains': ['Transportation & Logistics', 'Manufacturing and Production']}","A production company needs to transport TotalPeople using large mobile production units or small mobile production units. Large mobile production units can hold LargeUnitCapacity people and take up LargeUnitParkingSpots parking spots whereas small mobile production units can hold SmallUnitCapacity people and take up SmallUnitParkingSpots parking spots. Movie stars prefer to have their small mobile production unit to share with a close staff, therefore at least MinSmallUnits units must be small mobile units. However, due to logistic limitations, large mobile production units are more space efficient per spot, they must make up at least MinPercentageLargeUnits of all vehicles. Minimize the total number of parking spots required by this production.",242
552,"""The goal is to minimize the total number of parking spots required by this production""",$\min ( \text{numLargeUnits} \times \text{LargeUnitParkingSpots} + \text{numSmallUnits} \times \text{SmallUnitParkingSpots} )$,The total number of parking spots required for large and small mobile production units must be minimized.,$Z = \text{numLargeUnits} \times \text{LargeUnitParkingSpots} + \text{numSmallUnits} \times \text{SmallUnitParkingSpots}$,"{'types': ['Resource Allocation and Management', 'Production Planning'], 'domains': ['Transportation & Logistics', 'Manufacturing and Production']}","A production company needs to transport TotalPeople using large mobile production units or small mobile production units. Large mobile production units can hold LargeUnitCapacity people and take up LargeUnitParkingSpots parking spots whereas small mobile production units can hold SmallUnitCapacity people and take up SmallUnitParkingSpots parking spots. Movie stars prefer to have their small mobile production unit to share with a close staff, therefore at least MinSmallUnits units must be small mobile units. However, due to logistic limitations, large mobile production units are more space efficient per spot, they must make up at least MinPercentageLargeUnits of all vehicles. Minimize the total number of parking spots required by this production.",242
553,"""The goal is to minimize the total number of boxes needed to distribute the required number of masks""",$\min \text{smallBoxes} + \text{largeBoxes}$,The number of small boxes should be at least MinSmallToLargeRatio times the number of large boxes,$smallBoxes \\geq MinSmallToLargeRatio \\times largeBoxes$,"{'types': ['Resource Allocation and Management', 'Sizing', 'Packaging'], 'domains': ['Supply Chain Management', 'Retail and E-commerce']}","A company ships items to stores using two different types of boxes. A small box holds MasksInSmallBox masks whereas a large box holds MasksInLargeBox masks. Since small boxes are easier to stack and will be used first to stock stores, there must be at least MinSmallToLargeRatio times as many small boxes as large boxes. Additionally, at least MinLargeBoxes large boxes must be used. If at least MinMasksRequired masks are required to be distributed, how many of each size of box should be used to minimize the total number of boxes needed?",243
554,"""The goal is to minimize the total number of boxes needed to distribute the required number of masks""",$\min \text{smallBoxes} + \text{largeBoxes}$,The number of large boxes should be at least MinLargeBoxes,$largeBoxes \geq MinLargeBoxes$,"{'types': ['Resource Allocation and Management', 'Sizing', 'Packaging'], 'domains': ['Supply Chain Management', 'Retail and E-commerce']}","A company ships items to stores using two different types of boxes. A small box holds MasksInSmallBox masks whereas a large box holds MasksInLargeBox masks. Since small boxes are easier to stack and will be used first to stock stores, there must be at least MinSmallToLargeRatio times as many small boxes as large boxes. Additionally, at least MinLargeBoxes large boxes must be used. If at least MinMasksRequired masks are required to be distributed, how many of each size of box should be used to minimize the total number of boxes needed?",243
555,"""The goal is to minimize the total number of boxes needed to distribute the required number of masks""",$\min \text{smallBoxes} + \text{largeBoxes}$,The total number of masks distributed should be at least MinMasksRequired,$smallBoxes \times MasksInSmallBox + largeBoxes \times MasksInLargeBox \geq MinMasksRequired$,"{'types': ['Resource Allocation and Management', 'Sizing', 'Packaging'], 'domains': ['Supply Chain Management', 'Retail and E-commerce']}","A company ships items to stores using two different types of boxes. A small box holds MasksInSmallBox masks whereas a large box holds MasksInLargeBox masks. Since small boxes are easier to stack and will be used first to stock stores, there must be at least MinSmallToLargeRatio times as many small boxes as large boxes. Additionally, at least MinLargeBoxes large boxes must be used. If at least MinMasksRequired masks are required to be distributed, how many of each size of box should be used to minimize the total number of boxes needed?",243
556,"""The goal is to maximize the amount of cars processed every hour""",$\max (\text{numElectricJacks} \times \text{CarsPerHourElectric} + \text{numGasJacks} \times \text{CarsPerHourGas})$,The number of automatic electric jacks must be less than MaxElectricJacks,$\\text{numElectricJacks} < \\text{MaxElectricJacks}$,"{'types': ['Resource Allocation and Management', 'Production Planning'], 'domains': ['Manufacturing and Production', 'Supply Chain Management']}","An autobody shop needs to purchase two types of car jacks, an automatic electric one, or a gas-powered one. The automatic electric one can process CarsPerHourElectric cars every hour and uses ElectricityPerHourElectric units of electricity whereas the gas-powered one can process CarsPerHourGas cars each hour using GasPerHourGas units of gas. Since there is a limit to how many automatic electric ones there can be due to the limited number of power outlets, the shop must use less than MaxElectricJacks automatic electric ones. The shop can use at most MaxElectricity units of electricity and MaxGas units of gas. How many of each type of jack should the shop purchase to maximize the amount of cars processed every hour?",245
557,"""The goal is to maximize the amount of cars processed every hour""",$\max (\text{numElectricJacks} \times \text{CarsPerHourElectric} + \text{numGasJacks} \times \text{CarsPerHourGas})$,The total electricity used by all automatic electric jacks must be less than or equal to MaxElectricity,$\text{numElectricJacks} \times \text{ElectricityPerHourElectric} \leq \text{MaxElectricity}$,"{'types': ['Resource Allocation and Management', 'Production Planning'], 'domains': ['Manufacturing and Production', 'Supply Chain Management']}","An autobody shop needs to purchase two types of car jacks, an automatic electric one, or a gas-powered one. The automatic electric one can process CarsPerHourElectric cars every hour and uses ElectricityPerHourElectric units of electricity whereas the gas-powered one can process CarsPerHourGas cars each hour using GasPerHourGas units of gas. Since there is a limit to how many automatic electric ones there can be due to the limited number of power outlets, the shop must use less than MaxElectricJacks automatic electric ones. The shop can use at most MaxElectricity units of electricity and MaxGas units of gas. How many of each type of jack should the shop purchase to maximize the amount of cars processed every hour?",245
558,"""The goal is to maximize the amount of cars processed every hour""",$\max (\text{numElectricJacks} \times \text{CarsPerHourElectric} + \text{numGasJacks} \times \text{CarsPerHourGas})$,The total gas used by all gas-powered jacks must be less than or equal to MaxGas,$numGasJacks \times GasPerHourGas \leq MaxGas$,"{'types': ['Resource Allocation and Management', 'Production Planning'], 'domains': ['Manufacturing and Production', 'Supply Chain Management']}","An autobody shop needs to purchase two types of car jacks, an automatic electric one, or a gas-powered one. The automatic electric one can process CarsPerHourElectric cars every hour and uses ElectricityPerHourElectric units of electricity whereas the gas-powered one can process CarsPerHourGas cars each hour using GasPerHourGas units of gas. Since there is a limit to how many automatic electric ones there can be due to the limited number of power outlets, the shop must use less than MaxElectricJacks automatic electric ones. The shop can use at most MaxElectricity units of electricity and MaxGas units of gas. How many of each type of jack should the shop purchase to maximize the amount of cars processed every hour?",245
559,"""The goal is to minimize the total number of transportation units (trains and trams).""",$\min (\text{numberOfTrains} + \text{numberOfTrams})$,The number of trams must be at least MinTramToTrainRatio times the number of trains,$numberOfTrams \\geq MinTramToTrainRatio \\times numberOfTrains$,"{'types': ['Resource Allocation and Management', 'Scheduling', 'Balancing', 'Routing'], 'domains': ['Transportation & Logistics']}","A railway company is planning the infrastructure for the city and is considering two types of transportation, trains and trams. Each train can transport PeoplePerTrain people comfortably per hour and each tram can transport PeoplePerTram people comfortably per hour. Since trains take longer to build, the number of trams must be at least MinTramToTrainRatio times the number of trains. The company wants to transport at least MinTotalPeople people per hour and aims to minimize the total number of transportation units.",246
560,"""The goal is to minimize the total number of transportation units (trains and trams).""",$\min (\text{numberOfTrains} + \text{numberOfTrams})$,The total number of people transported per hour by trains and trams must be at least MinTotalPeople,$numberOfTrains \times PeoplePerTrain + numberOfTrams \times PeoplePerTram \geq MinTotalPeople$,"{'types': ['Resource Allocation and Management', 'Scheduling', 'Balancing', 'Routing'], 'domains': ['Transportation & Logistics']}","A railway company is planning the infrastructure for the city and is considering two types of transportation, trains and trams. Each train can transport PeoplePerTrain people comfortably per hour and each tram can transport PeoplePerTram people comfortably per hour. Since trains take longer to build, the number of trams must be at least MinTramToTrainRatio times the number of trains. The company wants to transport at least MinTotalPeople people per hour and aims to minimize the total number of transportation units.",246
561,"""The goal is to minimize the total number of transportation units (trains and trams).""",$\min (\text{numberOfTrains} + \text{numberOfTrams})$,Minimize the total number of transportation units (trains + trams),$\\text{Minimize} \\quad numberOfTrains + numberOfTrams$,"{'types': ['Resource Allocation and Management', 'Scheduling', 'Balancing', 'Routing'], 'domains': ['Transportation & Logistics']}","A railway company is planning the infrastructure for the city and is considering two types of transportation, trains and trams. Each train can transport PeoplePerTrain people comfortably per hour and each tram can transport PeoplePerTram people comfortably per hour. Since trains take longer to build, the number of trams must be at least MinTramToTrainRatio times the number of trains. The company wants to transport at least MinTotalPeople people per hour and aims to minimize the total number of transportation units.",246
562,"""The goal is to minimize the total number of transportation units (trains and trams).""",$\min (\text{numberOfTrains} + \text{numberOfTrams})$,auxiliary constraint,$numberOfTrams \\geq MinTramToTrainRatio \\cdot numberOfTrains$,"{'types': ['Resource Allocation and Management', 'Scheduling', 'Balancing', 'Routing'], 'domains': ['Transportation & Logistics']}","A railway company is planning the infrastructure for the city and is considering two types of transportation, trains and trams. Each train can transport PeoplePerTrain people comfortably per hour and each tram can transport PeoplePerTram people comfortably per hour. Since trains take longer to build, the number of trams must be at least MinTramToTrainRatio times the number of trains. The company wants to transport at least MinTotalPeople people per hour and aims to minimize the total number of transportation units.",246
563,"""The goal is to minimize the total number of transportation units (trains and trams).""",$\min (\text{numberOfTrains} + \text{numberOfTrams})$,auxiliary constraint,$PeoplePerTrain \\cdot numberOfTrains + PeoplePerTram \\cdot numberOfTrams \\geq MinTotalPeople$,"{'types': ['Resource Allocation and Management', 'Scheduling', 'Balancing', 'Routing'], 'domains': ['Transportation & Logistics']}","A railway company is planning the infrastructure for the city and is considering two types of transportation, trains and trams. Each train can transport PeoplePerTrain people comfortably per hour and each tram can transport PeoplePerTram people comfortably per hour. Since trains take longer to build, the number of trams must be at least MinTramToTrainRatio times the number of trains. The company wants to transport at least MinTotalPeople people per hour and aims to minimize the total number of transportation units.",246
564,"""The goal is to maximize the total amount of conversion to carbon dioxide""",$\max \sum_{i=1}^{\text{NumCatalysts}} \text{ConversionRate}[i] \cdot \text{numCatalystsUsed}[i]$,The total units of platinum used by all catalysts should not exceed the total available units of platinum,$\sum_{i=1}^{NumCatalysts} PlatinumRequired[i] \cdot numCatalystsUsed[i] \leq TotalPlatinumAvailable$,"{'types': ['Resource Allocation and Management', 'Production Planning'], 'domains': ['Manufacturing and Production', 'Supply Chain Management']}",An automotive company is comparing NumCatalysts different catalysts. The process with catalyst i requires PlatinumRequired[i] units of platinum and PalladiumRequired[i] units of palladium and can perform the conversion to carbon dioxide at a rate of ConversionRate[i] units per second. There are TotalPlatinumAvailable units of platinum and TotalPalladiumAvailable units of palladium available. How many of each catalyst should be used to maximize the amount converted into carbon dioxide?,247
565,"""The goal is to maximize the total amount of conversion to carbon dioxide""",$\max \sum_{i=1}^{\text{NumCatalysts}} \text{ConversionRate}[i] \cdot \text{numCatalystsUsed}[i]$,The total units of palladium used by all catalysts should not exceed the total available units of palladium,$\\sum_{i=1}^{\\text{NumCatalysts}} \\text{numCatalystsUsed}[i] \\times \\text{PalladiumRequired}[i] \\leq \\text{TotalPalladiumAvailable}$,"{'types': ['Resource Allocation and Management', 'Production Planning'], 'domains': ['Manufacturing and Production', 'Supply Chain Management']}",An automotive company is comparing NumCatalysts different catalysts. The process with catalyst i requires PlatinumRequired[i] units of platinum and PalladiumRequired[i] units of palladium and can perform the conversion to carbon dioxide at a rate of ConversionRate[i] units per second. There are TotalPlatinumAvailable units of platinum and TotalPalladiumAvailable units of palladium available. How many of each catalyst should be used to maximize the amount converted into carbon dioxide?,247
566,"""The goal is to maximize the total metal extracted from the ores""",$\max \left( MetalExtractedJ \cdot numProcessJ + MetalExtractedP \cdot numProcessP \right)$,Total water used by both processes should not exceed the maximum available units of water,$numProcessJ \\times WaterUsedJ + numProcessP \\times WaterUsedP \\leq MaxWater$,"{'types': ['Resource Allocation and Management', 'Production Planning'], 'domains': ['Manufacturing and Production', 'Environmental and Sustainability']}","There are two processes, J and P, to extract metal from ores. Process J extracts MetalExtractedJ units of metal using WaterUsedJ units of water and produces PollutionProducedJ units of pollution. Process P extracts MetalExtractedP units of metal using WaterUsedP units of water and produces PollutionProducedP units of pollution. The objective is to determine the number of times each process should be performed to maximize the total metal extracted, subject to the constraints that the total water used does not exceed MaxWater units and the total pollution produced does not exceed MaxPollution units.",248
